{
  "$schema": "../../schemas/page.schema.json",
  "feature": {
    "key": "interval-repetition",
    "label": "Interval Repetition"
  },
  "page": "ReviewSession",
  "frame": {
    "width": 390,
    "background": "color.background",
    "padding": "spacing.md"
  },
  "layout": {
    "type": "column",
    "gap": "spacing.lg",
    "align": "stretch"
  },
  "children": [
    {
      "type": "library-component",
      "library": "primevue",
      "component": "Toolbar",
      "design": {
        "appearance": "page-header",
        "state": "close"
      },
      "slots": {
        "start": [
          {
            "type": "library-component",
            "library": "primevue",
            "component": "Button",
            "props": {
              "aria-label": "Закрыть повторение",
              "icon": "pi pi-times",
              "iconPos": "left",
              "severity": "primary",
              "variant": "text"
            },
            "action": {
              "type": "navigate",
              "target": "RepetitionDashboard"
            },
            "design": {
              "appearance": "primary",
              "variant": "text",
              "size": "normal",
              "state": "default",
              "colorTreatment": "accessible-blue"
            }
          }
        ],
        "center": [
          {
            "type": "text",
            "name": "PageTitle",
            "value": "Повторение"
          }
        ]
      }
    },
    {
      "type": "column",
      "name": "ReviewProgress",
      "gap": "spacing.xs",
      "children": [
        {
          "type": "text",
          "name": "ReviewProgressLabel",
          "value": "Осталось: 7",
          "style": {
            "fontSize": "font.size.sm",
            "fontWeight": "font.weight.medium",
            "color": "color.mutedText"
          }
        }
      ]
    },
    {
      "type": "library-component",
      "library": "primevue",
      "component": "Tag",
      "props": {
        "value": "Java · Core",
        "severity": "info"
      },
      "design": {
        "appearance": "specialization",
        "state": "default",
        "colorTreatment": "accessible-blue"
      }
    },
    {
      "type": "section",
      "name": "QuestionSection",
      "children": [
        {
          "type": "text",
          "name": "QuestionLabel",
          "value": "Вопрос",
          "style": {
            "fontSize": "font.size.sm",
            "fontWeight": "font.weight.semibold",
            "color": "color.mutedText"
          }
        },
        {
          "type": "text",
          "name": "QuestionText",
          "value": "Как работает HashMap внутри?",
          "style": {
            "fontSize": "font.size.xl",
            "fontWeight": "font.weight.bold",
            "color": "color.text"
          }
        },
        {
          "type": "library-component",
          "library": "primevue",
          "component": "Button",
          "props": {
            "label": "Показать ответ",
            "severity": "primary",
            "variant": "outlined"
          },
          "action": {
            "type": "command",
            "name": "showCanonicalAnswer"
          },
          "design": {
            "appearance": "primary",
            "variant": "outlined",
            "size": "normal",
            "state": "default",
            "colorTreatment": "accessible-blue"
          }
        }
      ]
    },
    {
      "type": "section",
      "name": "AnswerSection",
      "children": [
        {
          "type": "text",
          "name": "AnswerLabel",
          "value": "Каноничный ответ",
          "style": {
            "fontSize": "font.size.sm",
            "fontWeight": "font.weight.semibold",
            "color": "color.accessiblePrimary"
          }
        },
        {
          "type": "text",
          "name": "CanonicalAnswer",
          "value": "HashMap хранит пары ключ-значение в массиве бакетов. Позиция определяется по хешу ключа, а коллизии разрешаются внутри бакета.",
          "style": {
            "fontSize": "font.size.md",
            "color": "color.text"
          }
        },
        {
          "type": "library-component",
          "library": "primevue",
          "component": "Button",
          "props": {
            "label": "Скрыть ответ",
            "severity": "primary",
            "variant": "text"
          },
          "action": {
            "type": "command",
            "name": "hideCanonicalAnswer"
          },
          "design": {
            "appearance": "primary",
            "variant": "text",
            "size": "normal",
            "state": "default",
            "colorTreatment": "accessible-blue"
          }
        }
      ]
    },
    {
      "type": "section",
      "name": "RatingSection",
      "children": [
        {
          "type": "text",
          "name": "RatingPrompt",
          "value": "Насколько хорошо вы помнили ответ?",
          "style": {
            "fontSize": "font.size.md",
            "fontWeight": "font.weight.bold",
            "color": "color.text"
          }
        },
        {
          "type": "text",
          "name": "RatingHelpText",
          "value": "Оценка сохранит результат и откроет следующий вопрос.",
          "style": {
            "fontSize": "font.size.sm",
            "color": "color.mutedText"
          }
        },
        {
          "type": "library-component",
          "library": "primevue",
          "component": "SelectButton",
          "props": {
            "options": [
              "0 · Не помню",
              "1 · Очень трудно",
              "2 · Трудно",
              "3 · С подсказкой",
              "4 · Помню",
              "5 · Отлично"
            ],
            "allowEmpty": false
          },
          "action": {
            "type": "submit",
            "name": "saveRecallRating"
          },
          "design": {
            "appearance": "rating-scale",
            "state": "default",
            "colorTreatment": "accessible-blue"
          }
        }
      ]
    },
    {
      "type": "section",
      "name": "SubmissionStatus",
      "children": []
    }
  ],
  "states": {
    "loading": "A PrimeVue ProgressSpinner and Message appear while the first question is fetched",
    "answerHidden": "AnswerSection is hidden and Show answer remains visible",
    "answerShown": "AnswerSection is visible; rating remains available",
    "submitting": "PrimeVue SelectButton is disabled while the selected quality is submitted",
    "saveFailure": "Current question and selected quality are preserved; a PrimeVue Message offers Повторить отправку",
    "noQuestions": "Navigate to ReviewComplete",
    "close": "Return to RepetitionDashboard"
  },
  "requirements": {
    "sources": [
      "meta/business-analytics/functionality/interview-questions-interval-repetition.md",
      "meta/system-analytics/functionality/interview-questions-interval-repetition.md"
    ],
    "approvedAssumptions": [
      "Rating uses six SM-2 quality values from 0 through 5",
      "Users may rate without revealing the answer",
      "Progress displays only the guaranteed questions-left value",
      "Approved scoped accessible-blue treatment uses color.accessiblePrimary without changing the global primary token or unrelated artwork"
    ]
  }
}
