{
  "feature": { "key": "interval-repetition", "label": "Interval Repetition" },
  "page": "CategoryCatalog",
  "frame": { "width": 390, "background": "color.background", "padding": "spacing.md" },
  "layout": { "type": "column", "gap": "spacing.md", "align": "stretch" },
  "children": [
    { "type": "component", "component": "PageHeader", "variant": "back", "props": { "title": "Все темы", "trailingAction": "Поиск" } },
    { "type": "component", "component": "Input", "variant": "default", "props": { "placeholder": "Найти тему или специализацию", "icon": "⌕" } },
    { "type": "section", "name": "SpecializationList", "children": [
      { "type": "column", "name": "JavaSpecialization", "gap": "spacing.sm", "children": [
        { "type": "component", "component": "SpecializationBadge", "variant": "default", "props": { "label": "Java" } },
        { "type": "component", "component": "CategorySelectionRow", "variant": "selected", "props": { "title": "Core", "questionCount": "38 вопросов", "progress": "12 доступны", "action": "Удалить" } },
        { "type": "component", "component": "CategorySelectionRow", "variant": "available", "props": { "title": "JVM", "questionCount": "29 вопросов", "action": "Добавить" } },
        { "type": "component", "component": "CategorySelectionRow", "variant": "available", "props": { "title": "Concurrency", "questionCount": "24 вопроса", "action": "Добавить" } }
      ] },
      { "type": "column", "name": "BackendSpecialization", "gap": "spacing.sm", "children": [
        { "type": "component", "component": "SpecializationBadge", "variant": "default", "props": { "label": "Backend" } },
        { "type": "component", "component": "CategorySelectionRow", "variant": "selected", "props": { "title": "SQL", "questionCount": "22 вопроса", "progress": "На сегодня всё", "action": "Удалить" } }
      ] }
    ] },
    { "type": "section", "name": "InlineStatusRegion", "children": [] }
  ],
  "states": {
    "loading": "Category rows use disabled placeholders",
    "noResults": "EmptyState.noResults reflects the local text filter",
    "saving": "Only the mutated row uses CategorySelectionRow.saving",
    "saveFailure": "The previous row state is restored and inline retry is shown",
    "error": "FeedbackState.error replaces the list when initial loading fails"
  },
  "requirements": {
    "sources": ["meta/business-analytics/functionality/interview-questions-interval-repetition.md", "meta/system-analytics/functionality/interview-questions-interval-repetition.md"],
    "approvedAssumptions": ["Later category management applies add and remove immediately", "Search is a client-side filter over loaded categories"]
  }
}