{
  "$schema": "../../schemas/page.schema.json",
  "feature": {
    "key": "interval-repetition",
    "label": "Interval Repetition"
  },
  "page": "ReviewComplete",
  "frame": {
    "width": 390,
    "background": "color.background",
    "padding": "spacing.lg"
  },
  "layout": {
    "type": "column",
    "gap": "spacing.lg",
    "align": "center"
  },
  "children": [
    {
      "type": "section",
      "name": "CompletionSummary",
      "children": [
        {
          "type": "library-component",
          "library": "primevue",
          "component": "Message",
          "props": {
            "severity": "success",
            "closable": false
          },
          "design": {
            "appearance": "success",
            "state": "default"
          },
          "slots": {
            "default": [
              {
                "type": "column",
                "name": "CompletionMessageContent",
                "gap": "spacing.sm",
                "children": [
                  {
                    "type": "text",
                    "name": "CompletionTitle",
                    "value": "Повторение завершено"
                  },
                  {
                    "type": "text",
                    "name": "CompletionDescription",
                    "value": "Сегодня вы повторили 12 вопросов. Следующие вопросы появятся по расписанию."
                  }
                ]
              }
            ]
          }
        },
        {
          "type": "library-component",
          "library": "primevue",
          "component": "Card",
          "design": {
            "appearance": "metric",
            "state": "default"
          },
          "slots": {
            "content": [
              {
                "type": "text",
                "name": "ReviewedCount",
                "value": "12\nповторено сегодня"
              }
            ]
          }
        }
      ]
    },
    {
      "type": "section",
      "name": "CompletionActions",
      "children": [
        {
          "type": "library-component",
          "library": "primevue",
          "component": "Button",
          "props": {
            "label": "Вернуться к темам",
            "severity": "primary",
            "fluid": true
          },
          "action": {
            "type": "navigate",
            "target": "RepetitionDashboard"
          },
          "design": {
            "appearance": "primary",
            "variant": "filled",
            "size": "normal",
            "state": "default",
            "colorTreatment": "accessible-blue"
          }
        },
        {
          "type": "library-component",
          "library": "primevue",
          "component": "Button",
          "props": {
            "label": "Управлять темами",
            "severity": "secondary",
            "fluid": true
          },
          "action": {
            "type": "navigate",
            "target": "CategoryCatalog"
          },
          "design": {
            "appearance": "secondary",
            "variant": "filled",
            "size": "normal",
            "state": "default"
          }
        }
      ]
    }
  ],
  "states": {
    "countUnavailable": "Hide the reviewed-count metric and use a generic completion description"
  },
  "requirements": {
    "sources": [
      "meta/business-analytics/functionality/interview-questions-interval-repetition.md",
      "meta/system-analytics/functionality/interview-questions-interval-repetition.md"
    ],
    "approvedAssumptions": [
      "Review completion has a dedicated screen",
      "Reviewed count is displayed only when reliably tracked or returned",
      "Penpot uses the same page-scoped structural Message shell approach as ReviewSessionSaved, preserving CompletionMessageContent and its two text children; JSON/runtime semantics remain PrimeVue Message",
      "Approved scoped accessible-blue treatment uses color.accessiblePrimary without changing the global primary token or unrelated artwork"
    ]
  }
}
